,ICO Name,ICO Category Name,ICO Description,ICO Important,Money Goal,Money Goal Value,Website,Whitepaper,Facebook link,Twitter link,Telegram link,Medium link,Discord link,Ticker,Token type,ICO Price,Fundraising Goal,Fundraising Goal Value,Total Tokens,Total Tokens Value,Role of Token,Addional Link1,Min/Max Personal Cap,Accepts,Goal,Goal Value,Youtube link,Available for Token Sale,Whitelist,?an't participate,Addional Link2,Addional Link3,Addional Link4,Know Your Customer (KYC),Reddit link,Team from,Bonus for the First,Token Issue,Registered Company,Sold on presale,Pre-sale Bonus,Number of Team Members,Addional Link5
Continuum World,Continuum World,Gaming,"Continuum World is a Free-2-Play & Play-2-Earn MMO (Massively Multiplayer Online) game where players can explore a new world and build buildings to collect resources, level up, compete, socialise and earn.","Continuum World will hold a IGO on the 1. Oct. The IGO will happen on Seedify. (Details).
Continuum World will hold a Initial Dex Offering on the 3. Oct. The IDO will happen on TrustPad. (Details).","300,000",300000,https://continuum.world/?utm_source=icodrops,https://whitepaper.continuum.world/,https://www.facebook.com/Continuum-World-101611342112495,https://twitter.com/continuumworld,https://t.me/joinchat/vgP9kubXVmRmNjVl,https://medium.com/@continuumworld,https://discord.gg/MvGcbnsMJk,UM,ERC20,0.015,"20,000,000 TOKEN",20000000,"1,000,000,000",1000000000,UTILITY,IGO Info # https://medium.com/@continuumworld/announcing-a-dual-ido-on-seedify-trustpad-b25b3595cf8?source=user_profile---------0----------------------------,,,,,,,,,,,,,,,,,,,,,
Beta Finance,Beta Finance,Market,"Beta Finance is the permissionless money market for borrowing, lending, and shorting crypto assets.",Beta Finance will hold a Token Sale on the 30. Sept. The Token Sale will happen on Binance. (Details).,"3,000,000",3000000,https://betafinance.org/?utm_source=icodrops,https://betafinance.gitbook.io/betafinance/,,https://twitter.com/beta_finance,https://t.me/BetaFinanceProtocol,https://medium.com/beta-finance,https://discord.com/invite/kcecQQRyZJ,BETA,ERC20,0.06,"50,000,000 TOKEN",50000000,"1,000,000,000",1000000000,UTILITY,Token Sale on Binance # https://www.binance.com/en/support/announcement/be1c7f558fca417a9da6974e8c294d83,TBA / $20000,BNB,,,,,,,,,,,,,,,,,,,
Blocto,Blocto,Blockchain Platform,"Blocto token (BLT) is the utility and governance token of Blocto, which serves as the foundation of our ecosystem and the interconnective link between the wallet, Blocto made products, and our users.","Blocto held the Community Sale on July 13th. (Details).
Blocto will hold a Multi-Chain Ecosystem IDO on the 14. Sep. (Details).
The First Round of Multi-Chain Ecosystem IDO will happen on Impossible Finance (Details).
The Second Round will happen on the 24. Sept. The Public Sale will happen on Flow. (Registration).
The Third Round will happen on the 25. Sept. The IDO will happen on Dexlab. (Whitelist).","500,000",500000,https://token.blocto.app/?utm_source=icodrops,https://drive.google.com/file/d/1Csw31F-YOntZ6QQliCLY-i-A7lCd4Log/view,,https://twitter.com/BloctoApp,https://t.me/bloctoapp_official,https://medium.com/portto,https://discord.com/invite/H34KZqF,BLT,FLOW/SOLANA/BSC,0.4,"6,750,000 TOKEN",6750000,"500,000,000",500000000,UTILITY,One Pager # https://drive.google.com/file/d/1_Sox4V0KyGt8nFCVr4FhN0qfzQqwweHS/view,TBA / 1000 TUSDT,"USDC, BUSD, TUSDT, USDC(SPL)","1,500,000",1500000,https://www.youtube.com/channel/UCRXLmvEeMaCgsfWrDJr8rNA,2%,"YES (19 SEP – 24 SEP, JOIN )","AFGHANISTAN, BELARUS, BOSNIA AND HERZEGOVINA, BURUNDI, CENTRAL AFRICAN REPUBLIC, CHINA, CONGO, CUBA, ERITREA, HAITI, HONG KONG, IRAN, IRAQ, LEBANON, LIBYA, LIBERIA, MACAU, MYANMAR, NORTH KOREA, PUERTO RICO, SOUTH SUDAN, SUDAN, TAIWAN, USA, VENEZUELA, YEMEN, ZIMBABWE, US NON-ACCREDITED INVESTORS",Community Sale Info # https://medium.com/portto/blocto-is-excited-to-announce-the-community-sale-of-our-utility-token-blt-4233e0f52989,IDO Info # https://medium.com/dexlab-official/blocto-initial-dex-offering-9e3a21a2d8eb,Public Sale Info # https://medium.com/portto/blocto-token-blt-multi-chain-ecosystem-ido-03-blocto-token-blt-public-sale-dadf5f68adc0,,,,,,,,,,
Pledge Finance,Pledge Finance,Protocol,Pledge Finance is a decentralized protocol which establishes money markets with algorithmically optimized fixed interest rates.,"Pledge Finance will hold a Public Sale on the 30 Sep. (Registration).
Public Sale will hold 3 options.","3,120,000",3120000,https://www.pledger.finance/?utm_source=icodrops,https://www.pledger.finance/static/media/PledgeWhitepaper.pdf,,https://twitter.com/PledgerFinance,https://t.me/pledgerfinance,https://medium.com/pledge-finance,https://discord.com/channels/837168460341313586/837168512841547807,PLGR,BEP-20,0.1,"300,000,000 TOKEN",300000000,"3,000,000,000",3000000000,UTILITY,FAQ # https://intercom.help/pledgefinance/en,$300 / $50000,"ETH, BTC, USDT, USDC","27,420,000",27420000,https://www.youtube.com/channel/UCyMmR68x3zHh_lBXWEOuKVQ,10%,,"CRIMEA REGION, CUBA, IRAN, SYRIA, UKRAINE, USA",Public Sale Info # https://medium.com/pledge-finance/plgr-public-sale-faq-f5bda6d16817?source=collection_home---6------1-----------------------,,,"YES (PERIOD ISN'T SET, PASS )",,,,,,,,,
Highstreet,Highstreet,Marketplace,Highstreet is a limited edition marketplace catered to influencer lead brands or product collaboration between celebrities and artists.,"Highstreet will hold a Initial Dex Offering on the 27. Sept. The IDO will happen on Impossible Finance. (Details).
Highstreet will hold a Initial Dex Offering on the 7. Oct. The IDO will happen on Polkastarter. (Whitelist).","5,000,000",5000000,https://www.highstreet.market/?utm_source=icodrops,https://github.com/TravisBuilds/Highstreet,https://www.facebook.com/highstreetmkt,https://twitter.com/highstreetworld,https://t.me/highstreetworld,https://medium.com/highstreet-market,https://discord.gg/wxm6JNEbD9,HIGH,ERC20,1,"1,500,000 TOKEN",1500000,"100,000,000",100000000,UTILITY,IDO Info # https://medium.com/impossiblefinance/the-impossible-finance-ido-4-highstreet-token-sale-565866c29123,,,"6,500,000",6500000,https://www.youtube.com/channel/UCzXzF5_1RQupiUG0pVGJZmA,,"YES (24 SEP – 2 OCT, JOIN )","CHINA, IRAN, NORTH KOREA, USA, US NON-ACCREDITED INVESTORS",Funding Round # https://medium.com/highstreet-market/htc-backed-vr-metaverse-highstreet-raises-5-million-in-latest-funding-round-to-expand-unity-mobile-ac9d302852b3,,,,,,,,,,,,
NFracTion,NFracTion,Marketplace,NFracTion is a unique fractionalized NFT's & a cross-chain NFT marketplace.,NFracTion will hold a Initial Dex Offering on the 30. Sept. The IDO will happen on OccamRazer. (Details).,"1,480,000",1480000,https://www.nfraction.com/?utm_source=icodrops,https://www.nfraction.com/images/pitchdeck.pdf,,https://twitter.com/nfraction_com,https://t.me/nfraction_official,https://medium.com/@nfractioncom,,NFTA,ERC20,0.06,"5,000,000 TOKEN",5000000,"100,000,000",100000000,UTILITY,IDO Info # https://medium.com/occam-finance/nfraction-to-launch-ido-on-the-occamrazer-launchpad-7ee14ebf0e85,,,"1,780,000",1780000,https://github.com/nfractioncom,,,,,,,,https://www.reddit.com/user/NFracTioncom,,,,,,,,
Dark Frontiers,Dark Frontiers,Blockchain Service,Dark Frontiers is a DAO virtual world governed by the players.,"Dark Frontiers will hold a Strong Holder Offering on the 1. Oct. The SHO will happen on DAO Maker. (Whitelist).
Dark Frontiers will hold a Token Sale on the 6. Oct. The Token Sale will happen on GameStarter, RedKite, GameFi.","3,380,000",3380000,https://www.darkfrontiers.com/?utm_source=icodrops,,,https://twitter.com/DarkFrontiersGS,https://t.me/darkfrontiers,,https://discord.com/invite/KFYxndrana,DARK,BEP-20,0.05,"2,400,000 TOKEN",2400000,"250,000,000",250000000,UTILITY,SHO Info # https://daomaker.com/company/dark-frontiers,,,"3,500,000",3500000,,,"YES (PERIOD ISN'T SET, JOIN )",,,,,,,,,,,,,,
Monsoon Finance,Monsoon Finance,Blockchain Service,Monsoon Finance is building a suite of privacy tools for every DeFi user of every smart contracts blockchain.,"Monsoon Finance will hold a Initial Dex Offering on the 27. Sept. The IDO will happen on Polystarter, Bullperks.",OT SET,,https://monsoon.finance/?utm_source=icodrops,,,https://twitter.com/MonsoonFi,https://t.me/monsoonfinance,,,MCASH,ERC20,,TOKEN,,,,UTILITY,FAQ # https://monsoon.finance/#faq,,,,,https://github.com/monsoonfinance,,,,,,,,,,,,,,,,
FUFU,FUFU,Platform,"FUFU is the go-to platform for users to create quizzes, share it with friends, and earn NFTs through the reward system.",FUFU will hold a Initial Dex Offering on the 30. Sept. The IDO will happen on BSC Station. (Details).,"1,700,000",1700000,https://uwufufu.com/?utm_source=icodrops,,,https://twitter.com/getFUFU,https://t.me/FUFUofficial,https://medium.com/@GetFUFU,,FUFU,ERC20,0.02,"95,000,000 TOKEN",95000000,"1,000,000,000",1000000000,UTILITY,Seed Round # https://news.bitcoin.com/fufu-raises-1-7m-from-major-investors-to-develop-the-next-generation-content-marketing-platform/,,,"3,600,000",3600000,,,,,Tokenomics # https://medium.com/@GetFUFU/fufus-tokenomics-and-token-utility-a92b3ad670d5,,,,,,,,,,,,
Bit2Me,Bit2Me,Blockchain Service,"Bit2Me is a simple, safe and fast place to buy, sell and manage your cryptocurrency portfolio.",Bit2Me will hold a ICO on the 6. Sept. (Details).,"23,430,000",23430000,https://bit2me.com/?utm_source=icodrops,,https://www.facebook.com/bit2me/,https://twitter.com/bit2me,https://t.me/Bit2Me_ES,,,B2M,ERC20,,TOKEN,,"5,000,000,000",5000000000,UTILITY,,,,,,https://www.youtube.com/channel/UCL7pJebvcEUGOALXOh0pJCw?sub_confirmation=1,35%,,,,,,,,,,,,,,,
AirNFTs,AirNFTs,Marketplace,AirNFTs is a NFT Marketplace on Binance Smart Chain.,"Create your NFT and earn BNB and AIRT for all your NFTs that you sell.
NFT/Token Sale on Launchpad","10,000,000",10000000,https://www.airnfts.com/?utm_source=icodrops,,,https://twitter.com/airnfts,https://t.me/airnfts,,https://discord.gg/TXjQUVWXx7,AIRT,BEP-20,0.05,BNB,,"1,000,000,000",1000000000,UTILITY,,,BNB,,,https://www.airnfts.com/blog,20%,,,,,,,,,,,,,,,
Altair,Altair,Blockchain Service,"Altair is one of the fastest spinning stars in the galaxy, and is also the bridge from Centrifuge to Kusama.",Altair will hold a crowdloan and also the distribution through the airdrop on the 30. Jun. (Whitelist).,OT SET,,https://centrifuge.io/altair/?utm_source=icodrops,,,https://twitter.com/altair_network,,https://medium.com/altair-network,,AIR,ERC20,0.53,TOKEN,,"505,000,000",505000000,UTILITY,Crowdloan Info # https://medium.com/altair-network/the-altair-crowdloan-is-now-live-8b77b0bf7739,,,,,,,"YES (PERIOD ISN'T SET, JOIN )",,,,,,,,,,,,,,
Parallel Finance,Parallel Finance,Blockchain Service,"Parallel offers margin staking, auction loans, staking derivatives, and an AMM curve that enables significantly higher capital efficiency for DOT and KSM holders.",Parallel Finance will hold a Crowdloan on the 28. Aug. (Waitlist).,"22,000,000",22000000,https://parallel.fi/?utm_source=icodrops,https://docs.parallel.fi/white-paper,,https://twitter.com/ParallelFi,https://t.me/parallelfi,https://medium.com/parallel-finance,https://discord.gg/buKKx4dySW,PARA,POLKADOT,,TOKEN,,,,UTILITY,Tokenomics # https://docs.parallel.fi/parallel-token-economy-paper,,,,,https://github.com/parallel-finance,,"YES (UNTIL 30 SEP, JOIN )",,Seed Round # https://www.coindesk.com/lending-startup-parallel-finance-raises-2m-to-bring-more-defi-to-polkadot-kusama,Crowdloan Info # https://parallelfinance.medium.com/heikos-parachain-crowdloan-everything-you-need-to-know-297a3709b218,,,,,,,,,,,
Waggle Network,Waggle Network,Marketplace,"Waggle is a permissionless marketplace built for multi-chain token pools and auctions, enabling projects to raise capital post-IDO on a decentralized environment based on Solana.","Waggle Network will hold a Initial Dex Offering on the 2. Oct. The IDO will happen on Solanium. (Details).
Waggle Network will hold a Initial Dex Offering on the 8. Oct. The IDO will happen on Gate.io. (Details).","3,000,000",3000000,https://waggle.network/?utm_source=icodrops,https://docs.waggle.network/,,https://twitter.com/wagglenetwork,https://t.me/waggle_network,https://medium.com/@wagglenetwork,,WAG,SOLANA,0.25,"1,000,000 TOKEN",1000000,"100,000,000",100000000,UTILITY,Seed Round # https://medium.com/@wagglenetwork/waggle-network-successfully-raised-3-0-3e2291643ce3,,"USDT, USDC","3,250,000",3250000,,,,"AFGHANISTAN, ALBANIA, BELARUS, BOSNIA AND HERZEGOVINA, BURMA, BURUNDI, CANADA, CHINA, CONGO, CUBA, ETHIOPIA, IRAN, IRAQ, JAPAN, LEBANON, LIBYA, LIBERIA, MACEDONIA, MALAYSIA, NEW ZEALAND, SERBIA, SOMALIA, SUDAN, SRI LANKA, TRINIDAD, TOBAGO, TUNISIA, UKRAINE, UGANDA, USA, VENEZUELA, YEMEN, ZIMBABWE",IDO on Solanium # https://www.solanium.io/project/waggle-network/,IDO on Gate.io # https://www.gate.io/ru/article/22907/gate.io-startup-initial-offering-waggle-network-wag,,,,,,,,,,,
Heroes & Empires,Heroes & Empires,Gaming,"Heroes & Empires is a strategy game that combines the distinctive elements of Idle RPG and the tactics of auto chess, connected with blockchain technology.",Heroes & Empires will hold a Strong Holder Offering on the 4. Oct. The SHO will happen on DAO Maker. (Whitelist).,"1,500,000",1500000,https://heroesempires.com/?utm_source=icodrops,https://heroesempires.com/static/media/Pitch_Deck_Heroes_and_Empires_15Sep.75352940.pdf,https://www.facebook.com/HeroesEmpires,https://twitter.com/HeroesEmpires,https://t.me/HeroesEmpires,,https://discord.com/invite/HeroesEmpires,HE,BEP-20,0.01,"12,000,000 TOKEN",12000000,"1,000,000,000",1000000000,UTILITY,Docs # https://docs.heroesempires.com/,,,"1,660,000",1660000,https://www.youtube.com/HeroesEmpires,,"YES (PERIOD ISN'T SET, JOIN )",,Seed Round # https://cointelegraph.com/press-releases/blockchain-based-play-to-earn-game-heroes-empires-raised-15-m,SHO Info # https://daomaker.com/company/heroes-&-empires,,,,,,,,,,,
Aleph Zero,,,,,"4,900,000",4900000,https://alephzero.org/?utm_source=icodrops,https://alephzero.org/wp-content/uploads/2021/06/A0_BWP_06_2021.pdf,https://www.facebook.com/AlephZeroFoundation/,https://twitter.com/Aleph__Zero,https://t.me/AlephZeroFoundation,,,AZERO,OWN BLOCKCHAIN,0.1,ETH,,,,UTILITY,Seed and Strategic Round # https://alephzero.org/blog/aleph-zero-privacy-focused-public-blockchain-enterprise-seed-and-strategic-round/,,USDT,"14,800,000",14800000,https://alephzero.org/blog/,,,,FAQ # https://alephzero.org/faq/,Testnet # https://testnet.alephzero.org/,,,,,,,,,,,
Bloktopia,Bloktopia,Blockchain Service,Bloktopia will act as a tokenised decentralised VR Crypto Skyscraper powered by the Polygon Network.,"Bloktopia will hold a IGO on the 5. Oct. The IGO will happen on Seedify. (Details).
Bloktopia will hold a Initial Dex Offering on the 5. Oct. The IDO will happen on Red Kite. (Details).
Bloktopia will hold a Initial Dex Offering on the 6. Oct. The IDO will happen on TrustPad. (Details).
Bloktopia will hold a Initial Dex Offering on the 6. Oct. The IDO will happen on Oxbull. (Whitelist).","4,900,000",4900000,https://www.bloktopia.com/?utm_source=icodrops,https://www.bloktopia.com/wp-content/uploads/2021/08/Bloktopia-Lightpaper-.pdf,,https://twitter.com/bloktopia,https://t.me/BloktopiaChat,https://medium.com/@bloktopia,,BLOK,ERC20,0.00025,TOKEN,,"200,000,000,000",2E+11,UTILITY,IDO on on TrustPad # https://trustpad.medium.com/bloktopia-blok-are-launching-on-trustpad-8ab095ae5e26,,,,,,16%,"YES (PERIOD ISN'T SET, JOIN )",,IDO on Oxbull # https://oxbull.medium.com/to-enjoy-a-grander-sight-climb-to-a-greater-height-with-bloktopia-b3b32b59dec9,IDO on Red Kite # https://medium.com/polkafoundry/lets-immerse-yourselves-in-the-home-of-crypto-with-bloktopia-a48752c5a538,IGO on Seedify # https://medium.com/seedify/new-metaverse-is-coming-a-skyscraper-is-being-built-for-you-to-interact-with-the-future-5fbeabd770e0,,,,,,,,,,
Manga Fomo Chronicles,Manga Fomo Chronicles,Blockchain Service,Manga Fomo Chronicles is a series of manga NFT aimed at bringing communities and crypto projects closer in a funny and incentivised way.,Fomo Chronicles will hold a Initial Dex Offering on the 5. Oct. The IDO will happen on Poolz. (Details).,"740,000",740000,https://fomochronicles.com/?utm_source=icodrops,https://fomochronicles.com/wp-content/uploads/2021/09/FOMO%20Litepaper%202.3b%20(1).pdf,https://www.facebook.com/fomochronicles,https://twitter.com/FomoChronicles,https://t.me/FOMO_Chronicles,https://medium.com/@fomomanga,,OTAKU,BEP-20,2,TOKEN,,"950,000,000",950000000,UTILITY,IDO Info # https://poolz.finance/detail/about?id=75,,,,,https://www.youtube.com/channel/UCeHBvPQqbkGrZt_94PfaE0Q/featured,14%,,,,,,,,,,,,,,,
KSM Starter,KSM Starter,Blockchain Service,"KSM Starter, the primary launchpad on Kusama, is built to provide early-stage support and public funding for projects building on Substrate.",KSM Starter will hold a Initial Dex Offering on the 7. Oct. (Whitelist).,"1,760,000",1760000,https://ksmstarter.com/?utm_source=icodrops,https://ksmstarter.com/wp-content/uploads/2021/09/ksm_starter.pdf,,https://www.twitter.com/KSMStarter,https://t.me/KSM_starter,https://ksmstarter.medium.com/,,KST,ERC20,0.12,"1,800,000 TOKEN",1800000,,,UTILITY,IDO Info # https://ksmstarter.medium.com/open-now-ksm-starter-kst-ido-whitelist-campaign-ffc89e44ae8d,,,"2,530,000",2530000,,,"YES (1 OCT – 3 OCT, JOIN )",,,,,,,,,,,,,,
DecentraWeb,DecentraWeb,Blockchain Service,DecentraWeb aims to transform the internet and DNS (Domain Name System) by allowing anyone to permissionessly create their own top level domain (TLD) and own it permanently on the Ethereum blockchain.,DecentraWeb will hold a Initial Dex Offering on the 8. Oct. The IDO will happen on Poolz. (Details).,"2,050,000",2050000,https://decentraweb.org/?utm_source=icodrops,https://docs.google.com/presentation/d/15TbRhxlSgbsKIBUI3Oa97rCQQXYp8xFaetSqIFkRoYI/edit#slide=id.p1,https://www.facebook.com/DecentraWeb-107940658275724,https://twitter.com/decentra_web,https://t.me/decentraweb,,https://discord.gg/XT2zGPz5,DWEB,ERC20,0.12,"5,000,000 TOKEN",5000000,"100,000,000",100000000,UTILITY,IDO Info # https://poolz.finance/detail/about?id=78,,,"2,650,000",2650000,,,,,,,,,https://www.reddit.com/r/DecentraWeb/,,,,,,,,
The Three Kingdoms,The Three Kingdoms,Gaming,The Three Kingdoms is a 3rd Generation NFT Game that adopts the three Kingdoms storyline.,The Three Kingdoms will hold a Strong Holder Offering on the 11. Oct. The SHO will happen on DAO Maker.,OT SET,,https://ttk.gg/?utm_source=icodrops,https://ttk.gg/wp-content/uploads/2021/09/The-Three-Kingdoms-Commercial-Deck-v1-1.pdf,,https://twitter.com/PlayTTK,https://t.me/TTK_Official,https://medium.com/@PlayTTK,https://discord.com/invite/kg4SMdCCM5,,ERC20,,TOKEN,,,,UTILITY,,,,,,,,,,,,,,https://reddit.com/r/PlayTTK,,,,,,,,
Ore Network,Ore Network,Blockchain Service,"Ore Network is a purpose built blockchain optimized for managing secure identities, access and digital assets across chains.","Ore Network will hold a Initial Dex Offering on the 12. Oct. The IDO will happen on Occam, Poolz and Scaleswap. (Details).","450,000",450000,https://ore.network/?utm_source=icodrops,https://ore.network/wp-content/uploads/2021/09/ORE-Whitepaper-2.0.pdf,,https://twitter.com/oreprotocol,https://t.me/orecommunity,https://medium.com/@ORE_Network,,ORE,ERC20,,"$450,000 ",450000,,,UTILITY,Litepaper # https://ore.network/wp-content/uploads/2021/09/ORE-Litepaper.pdf,,,,,,,,,IDO Info # https://medium.com/@ORE_Network/occam-poolz-and-scaleswap-host-ore-token-ido-77dbdf568f37,IDO on Poolz # https://poolz.finance/detail/about?id=80,,,,,,,,,,,
Derived,Derived,Protocol,"Derived is a decentralised multi-chain asset protocol giving users the access to trade Stocks, Commodities, Forex or Crypto on a single platform with unlimited liquidity and no slippage.","Derived will hold a Initial Dex Offering on the 13. Oct. The IDO will happen on Poolz. (Details).
Derived will hold a Initial Dex Offering on the 14. Oct. The IDO will happen on OccamFi. (Details).",OT SET,,https://derived.fi/?utm_source=icodrops,https://github.com/DerivedFinance/Whitepaper/blob/main/Derived%20WP%20v2.6.pdf,,https://twitter.com/DerivedFinance,https://t.me/derivedFi,https://medium.com/@DerivedFinance,,DVD,ERC20,0.0625,TOKEN,,"1,000,000,000",1000000000,UTILITY,IDO on OccamFi # https://derivedfinance.medium.com/deriv-ido-on-occamrazer-launchpad-51ceed87cb02,,,,,https://github.com/DerivedFinance,,,,IDO on Poolz # https://derivedfinance.medium.com/derived-fi-upcoming-ido-on-poolz-dual-ido-898868b86856,,,,,,,,,,,,
Gods Unchained,Gods Unchained,Gaming,"A trading card game powered by the Ethereum Blockchain, where your ownership of each card is guaranteed by a smart contract.",Gods Unchained will hold a Token Sale on the 13. Oct. The Token Sale will happen on CoinList. (Details).,"15,000,000",15000000,https://godsunchained.com/?utm_source=icodrops,,https://www.facebook.com/godsunchained/,https://twitter.com/godsunchained,,https://medium.com/@fuelgames,https://discord.gg/DKGr2pW,GODS,ERC20,0.336,"35,000,000 TOKEN",35000000,"200,000,000",200000000,UTILITY,Explore # https://godsunchained.com/explore/citadel,$100 / $500,"ETH, BTC, USDT, USDC","25,320,000",25320000,https://www.youtube.com/channel/UCGQ1oWpKFfjsLYiTYALAlSA,,,"AUSTRALIA, CANADA, CHINA, US NON-ACCREDITED INVESTORS",Token Info # https://support.godsunchained.com/hc/en-us/articles/4402671576591,Token Sale on CoinList # https://blog.coinlist.co/announcing-the-gods-unchained-gods-token-sale-on-coinlist/,,,https://reddit.com/r/godsunchained,,,,,,,,
Blockchain Monster Hunt,Blockchain Monster Hunt,Gaming,Blockchain Monster Hunt is a multi-chain game that runs entirely on the blockchain itself.,"Blockchain Monster Hunt will hold a Initial Dex Offering on the 14. Oct. The IDO will happen on Polkastarter, ChainBoost and MoonEdge. (Details).","3,800,000",3800000,https://bcmhunt.com/?utm_source=icodrops,https://bcmhunt.gitbook.io/bcmhunt/,,https://twitter.com/bcmhunt,https://t.me/BcmHuntGroup,,https://discord.gg/Ee9aJ287J2,BCMC,ERC20,0.09,"2,000,000 TOKEN",2000000,"1,000,000,000",1000000000,UTILITY,Tokenomics # https://bcmhunt.com/tokenomics,TBA / $180,BNB,"3,980,000",3980000,https://www.youtube.com/channel/UCzKIjqylMMBngslHazydgKQ,,,,IDO Info # https://blog.bcmhunt.com/blockchain-monster-hunt-ido-whitelist-on-polkastarter-is-now-live-3b8d093d3a71,Funding Round # https://blog.bcmhunt.com/wip-blockchain-monster-hunt-raises-3-8m-usd-in-the-first-funding-round-1f6b3bde6ab,,,,,,,,,,,
DeFi Land,DeFi Land,Gaming,DeFi Land is a multi-chain agriculture-simulation web-game created to gamify decentralized finance.,DeFi Land will hold a Initial Dex Offering on the 14. Oct. The IDO will happen on Solanium. (Details).,"4,100,000",4100000,https://defiland.app/?utm_source=icodrops,,,https://twitter.com/DeFi_Land,https://t.me/defiland_official,https://defiland.medium.com/,https://discord.gg/defiland,DFL,ERC20,0.005,"20,000,000 TOKEN",20000000,,,UTILITY,Seed Round # https://cointelegraph.com/news/defi-land-raises-4-1m-to-launch-decentralized-finance-game-on-solana,,USDC,"4,200,000",4200000,,,,,IDO Info # https://www.solanium.io/project/defiland/,,,,,,,,,,,,
Revault,Revault,Blockchain Service,"Revault brings the power of easy search navigation to the DeFi ecosystem, enabling anyone to find and deposit funds in the best performing vaults on any blockchain at any given time.",Revault will hold a Initial Dex Offering on the 15. Oct. The IDO will happen on Poolz. (Details).,"430,000",430000,https://www.revault.network/?utm_source=icodrops,,,https://twitter.com/revaultnetwork,https://t.me/revaultnetwork,https://revaultnetwork.medium.com/,https://discord.gg/revaultnetwork,REVA,ERC20,2.2,TOKEN,,"18,181,818",18181818,UTILITY,Tokenomics # https://revaultnetwork.medium.com/revaults-token-economics-e9bef267d9d2,,,,,https://www.youtube.com/channel/UC7bPg7YDeYOd9ADNImgXMYw,,,,Sale on Poolz # https://www.poolz.finance/detail/about?id=66,IDO on Poolz # https://poolz.finance/detail/about?id=66,,,,,,,,,,,
Nyan Heroes,Nyan Heroes,Gaming,"Nyan Heroes is an NFT game built on the Solana blockchain, that is part of the ""play to earn"" metaverse.",Nyan Heroes will hold a NFT Pre-Sale on the 16. Oct. The NFT Sale will happen on the 8. Nov. (Details).,"2,510,000",2510000,https://nyanheroes.com/?utm_source=icodrops,https://nyan-heroes.gitbook.io/nyan-heroes/,,https://twitter.com/nyanheroes,https://t.me/nyanheroes/,https://nyanheroes.medium.com/,https://discord.gg/nyanheroes,NYN,SOLANA,456,"5,500 TOKEN",5500,,,UTILITY,FAQ # https://nyanheroes.com/faq,,,,,https://www.youtube.com/channel/UCjL9JLuurNx4p6o8sttWwDA/,5%,,,Sale Info # https://nyanheroes.medium.com/nyan-heroes-announces-details-of-their-genesis-nft-sale-c727c48f4d10,,,,,,,,,,,,
Acura Network,Acura Network,Blockchain Service,Acura Network is a redefined decentralized trading platform and liquidity protocol powered by Acura on Polygon.,Acura Network will hold a Initial Dex Offering on the 16. Oct.,"1,160,000",1160000,https://acuranetwork.io/?utm_source=icodrops,https://acuranetwork.io/assets/Whitepaper.pdf,,https://twitter.com/acuranetwork,https://t.me/acuranetworkann,https://acuranetwork.medium.com/,https://discord.gg/97JQ9EMkBb,ACURA,ERC20,,ETH,,"1,000,000,000",1000000000,UTILITY,,,USDT,,,https://github.com/AcuraNetwork,,,,,,,,,,,,,,,,
