Risk Harbor,Risk Harbor,Marketplace,Risk Harbor is a risk management marketplace for decentralized finance (DeFi).,There is no data on the upcoming ICO.,"3,250,000",3250000,https://www.riskharbor.com/?utm_source=icodrops,https://github.com/Risk-Harbor/RiskHarbor-Whitepaper/blob/main/Whitepaper.pdf,,https://twitter.com/riskharbor,,https://medium.com/@riskharbor,https://discord.gg/7aAC4p6vsr,,ERC20,,,,,,UTILITY,Seed Funding Round # https://www.coindesk.com/defi-insurance-upstart-risk-harbor-goes-live-with-3-25m-in-seed-funding,,,,,https://www.linkedin.com/company/riskharbor/,,,,Docs # https://docs.riskharbor.com/,Mainnet Info # https://medium.com/riskharbor/risk-harbor-debuts-on-mainnet-with-a-new-round-of-funding-b18064dbd5dc,App # https://app.riskharbor.com/,,,,,,,,,,
Yield Protocol,Yield Protocol,Protocol,"Yield is an Ethereum protocol to bring fixed-term, fixed-rate lending and interest-rate markets to decentralized finance.",There is no data on the upcoming ICO.,"10,000,000",10000000,https://yield.is/?utm_source=icodrops,https://yield.is/Yield.pdf,,https://twitter.com/yield,,https://medium.com/yield-protocol,https://discord.gg/JAFfDj5,,ERC20,,,,,,UTILITY,Funding Round # https://medium.com/yield-protocol/yield-closes-10mm-funding-round-led-by-paradigm-7e456e72b5e3,,,,,https://github.com/yieldprotocol,,,,Docs # https://docs.yield.is/,,,,,,,,,,,,
Kaiko,Kaiko,Market,Kaiko is a cryptocurrency market data provider for institutional investors and enterprises.,There is no data on the upcoming ICO.,"24,000,000",24000000,https://www.kaiko.com/?utm_source=icodrops,https://docs.kaiko.com/#introduction,,https://twitter.com/kaikodata,,,,,ERC20,,,,,,UTILITY,Funding Round # https://www.coindesk.com/crypto-data-firm-kaiko-looks-to-asia-after-24m-series-a,,,,,https://www.youtube.com/channel/UCrifCmD5GbPyhpc8nKsW_xQ,,,,Docs # https://www.kaiko.com/pages/cryptocurrency-data-types,,,,,,,,,,,,
Numbers,Numbers,Blockchain Service,Numbers helps solve the serious global problem of digital misinformation by creating a trust and verifiability system.,There is no data on the upcoming ICO.,OT SET,,https://numbersprotocol.io/?utm_source=icodrops,https://ipfs.io/ipfs/QmZooZxEGZ1pJviPHTTmqzAtdkvwDWA4vXxEq32B6ur8nq,https://www.facebook.com/numbersprotocol/,https://twitter.com/numbersprotocol,https://t.me/numbersprotocol,https://medium.com/numbers-protocol,,,ERC20,,,,,,UTILITY,,,,,,https://www.youtube.com/channel/UC9aIubRdrhLoSVb9xALFpUg,,,,,,,,,,,,,,,,
Tesseract,Tesseract,Blockchain Service,"Tesseract is a diversified financial services and investment management innovator in digital assets, powered by world-class technology.",There is no data on the upcoming ICO.,"25,000,000",25000000,https://tesseractinvestment.com/?utm_source=icodrops,,,,,,,,ERC20,,,,,,UTILITY,Series A Funding Round # https://tesseractinvestment.com/series-a/,,,,,https://tesseractinvestment.com/news/,,,,Media Kit # https://corexmsyxd575bs3y6n8.qualtrics.com/jfe/form/SV_8wViKnMDRCzqFkG,,,,,,,,,,,,
Decentral Games,Decentral Games,Blockchain Service,Decentral Games is a DAO-governed metaverse casino.,There is no data on the upcoming ICO.,"5,000,000",5000000,https://decentral.games/?utm_source=icodrops,https://docs.decentral.games/,,https://twitter.com/decentralgames,https://t.me/decentralgames,,https://discord.gg/cvbSNzY,DG,ERC20,,,,"1,000,000",1000000,UTILITY,Funding Round # https://www.coinspeaker.com/decentral-games-raises-5m-of-funding/,,,,,https://github.com/decentralgames,,,,Press Kit # https://drive.google.com/drive/u/1/folders/1YZ2j2zKQoSvwap6M3xecUHZwQmDLWBPC,,,,,,,,,,,,
Integritee,Integritee,Blockchain Service,Integritee is the public blockchain solution for securely processing sensitive business or personal data.,There is no data on the upcoming ICO.,"2,000,000",2000000,https://www.integritee.network/?utm_source=icodrops,,,https://twitter.com/integri_t_e_e,,,,,ERC20,,,,,,UTILITY,Seed Round # https://www.integritee.network/post/integritee-ag-secures-2-million-in-seed-round,,,,,https://www.integritee.network/category/news,,,,,,,,,,,,,,,,
SynFutures,SynFutures,Market,SynFutures is an open and trustless derivatives market that is quickly transforming the DeFi space.,There is no data on the upcoming ICO.,"15,400,000",15400000,https://www.synfutures.com/?utm_source=icodrops,https://www.synfutures.com/synfutures-whitepaper.pdf,,https://twitter.com/SynFuturesDefi,https://t.me/synfutures_Defi,https://synfutures.medium.com/,https://discord.gg/qMX2kcQk7A,,ERC20,,,,,,UTILITY,Series A Funding Round # https://synfutures.medium.com/synfutures-raises-an-additional-14m-in-series-a-funding-round-fa201ad4035a,,,,,https://github.com/SynFutures,,,,Tech Paper # https://www.synfutures.com/synfutures-v1-techpaper.pdf,Audit Report # https://www.synfutures.com/peckshield-audit-report-synfutures-v1.1.pdf,,,,,,,,,,,
HurricaneSwap,HurricaneSwap,Protocol,"HurricaneSwap is a decentralized trading protocol based on Avalanche, which supports multi-chain assets trading.",There is no data on the upcoming ICO.,"1,000,000",1000000,https://hurricane.exchange/#/swap?utm_source=icodrops,,,https://twitter.com/hurricaneswap,https://t.me/HurricaneSwap,https://hurricaneswap.medium.com/,https://discord.gg/2MkuTycWbJ,,ERC20,,,,,,UTILITY,Funding Round # https://hurricaneswap.medium.com/the-new-age-of-cross-chain-transactions-hurricaneswap-attracts-massive-funding-70909d17bd2f,,,,,,,,,,,,,,,,,,,,,
Apricot Finance,Apricot Finance,Platform,"Apricot Finance is a decentralized platform for devolved financial solutions, providing over-collateralized loan protocols to its users.",There is no data on the upcoming ICO.,"800,000",800000,https://apricot.one/#/Product?utm_source=icodrops,https://apricot.one/Whitepaper.pdf,,https://twitter.com/ApricotFinance,https://t.me/Apricotfinancechat,https://apricotfinance.medium.com/,,"APR, COT",ERC20,,,,,,UTILITY,Seed Round # https://apricotfinance.medium.com/apricot-seed-round-complete-with-800-000-be5156ea2ee8,,,,,,,,,,,,,https://www.reddit.com/user/ApricotFinance,,,,,,,,
Instadapp,Instadapp,Platform,Instadapp is a full feature platform for both users and developers to leverage the full potential of DeFi.,There is no data on the upcoming ICO.,"10,000,000",10000000,https://instadapp.io/?utm_source=icodrops,https://docs.instadapp.io/,,https://twitter.com/instadapp,,,https://discord.com/invite/C76CeZc,INST,ERC20,,,,"100,000,000",100000000,UTILITY,Funding Round # https://www.theblockcrypto.com/linked/108224/defi-startup-instadapp-raises-10-million-in-new-funding,,,,,https://www.youtube.com/channel/UCinS9sgInaP2iVt5TTaFB_g,,,,Tokenomics # https://blog.instadapp.io/inst,,,,,,,,,,,,
XVERSE,XVERSE,Platform,XVERSE is the all-in-one blockchain platform for real-time metaverse community and your digital twin.,There is no data on the upcoming ICO.,"2,700,000",2700000,https://xverse.ai/?utm_source=icodrops,,https://www.facebook.com/xverseoffical/,https://twitter.com/Xverseofficial,https://t.me/xverseofficial,https://xverse-official.medium.com/,,,ERC20,,,,,,UTILITY,Strategic Investment Round # https://www.prnewswire.com/news-releases/xverse-completes-strategic-investment-round-to-debut-metaverse-nft-marketplace-301313461.html?tc=eml_cleartime,,,,,https://www.youtube.com/channel/UCLwQLIPitnVVYb_nwR5BlgQ,,,,,,,,,,,,,,,,
Swaperry,Swaperry,DEX,"Swaperry is a decentralized exchange (DEX) designed to be highly performant, transparent and feature-riched to asset traders.",There is no data on the upcoming ICO.,OT SET,,https://swaperry.com/?utm_source=icodrops,https://docs.swaperry.com/,,https://twitter.com/swaperrydex,https://t.me/swaperry,https://medium.com/swaperry,,PERRY,ERC20,,,,"200,000,000",200000000,UTILITY,,,,,,,,,,,,,,,,,,,,,,
Creator Platform,Creator Platform,Blockchain Service,"Creator is a Blockchain-as-a-Service (BaaS) that provides No Code Smart Contract, Low Code DApp and other services to empower the NFT economy.",There is no data on the upcoming ICO.,"340,000",340000,https://www.creatorchain.network/?utm_source=icodrops,https://docsend.com/view/kn8civmicttnr5w5,https://www.facebook.com/Creator-Platform-101673428778301,https://twitter.com/CreatorCTR,https://t.me/creatorplatform,https://creatorplatfor1.medium.com/,,CTR,ERC20,,,,"150,000,000",150000000,UTILITY,Tokenomics # https://docsend.com/view/28ybbt72yndymdy3,,,"2,380,000",2380000,https://www.linkedin.com/in/platform-creator-494692212,,,,,,,,,,,,,,,,
Umee,Umee,Blockchain Service,Umee is decentralized infrastructure for cross chain interactions between networks.,There is no data on the upcoming ICO.,"6,300,000",6300000,http://umee.cc/?utm_source=icodrops,,,https://twitter.com/Umee_crosschain,,https://medium.com/umeeblog,https://discord.gg/FBJPPV52aF,,ERC20,,,,,,UTILITY,Seed Round # https://www.coindesk.com/umee-raises-6-3m-to-connect-cosmos-and-ethereum-with-cross-chain-defi,,,,,,,,,,,,,,,,,,,,,
Uptick,Uptick,Blockchain Service,Uptick is a business class NFT app built on the Uptick Network.,There is no data on the upcoming ICO.,OT SET,,https://www.uptickproject.com/?utm_source=icodrops,,,https://twitter.com/Uptickproject,https://t.me/uptickproject,https://medium.com/@uptickproject,,,ERC20,,,,,,UTILITY,First Fundraising Round # https://uptickproject.medium.com/uptick-network-closes-first-round-of-fundraising-backed-by-global-investors-26cd1b8d61d0,,,,,,,,,,,,,,,,,,,,,
Hummingbot,Hummingbot,Blockchain Service,Hummingbot is open-source software that lets you build and run customizable trading strategies.,There is no data on the upcoming ICO.,"8,000,000",8000000,https://hummingbot.io/en/?utm_source=icodrops,https://hummingbot.io/liquidity-mining-whitepaper,,https://twitter.com/hummingbot_io,,,https://discord.hummingbot.io/,,ERC20,,,,,,UTILITY,Seed Round # https://news.crunchbase.com/news/cryptocurrency-trading-bot-platform-hummingbot-buzzes-with-8m-series-a/,,,,,https://www.youtube.com/channel/UCxzzdEnDRbylLMWmaMjywOA?sub_confirmation=1,,,,,,,,https://www.reddit.com/r/Hummingbot/,,,,,,,,
Peaq,Peaq,Blockchain Service,"Build, launch and scale decentralized platforms and solutions.",There is no data on the upcoming ICO.,"3,040,000",3040000,https://www.peaq.com/?utm_source=icodrops,,,https://twitter.com/peaqenterprise,,,,,ERC20,,,,,,UTILITY,Seed Round # https://www.peaq.com/blog/peaq-secures-eu2-5-million-and-announces-plans-for-token,,,,,https://www.youtube.com/channel/UCQwWWkS0EqKjq3RKT6r3pQA,,,,,,,,,,,,,,,,
Project SEED,Project SEED,Gaming,"Project SEED is one of the first gaming ecosystems built on the Solana blockchain that includes a Game Studio, DEX, NFT Marketplace, and Wallet.",There is no data on the upcoming ICO.,OT SET,,https://projectseed.io/?utm_source=icodrops,https://docsend.com/view/5rbetcgn4vvms4ny,,https://twitter.com/ProjectSeedGame,https://t.me/ProjectSeedAnnouncements,https://projectseed.medium.com/,https://discord.gg/UGBUSgbBCJ,SHILL,ERC20,,,,"1,000,000,000",1000000000,UTILITY,Pitch Deck # https://docsend.com/view/78ha26nt98i3tw6g,,,,,,,,,,,,,,,,,,,,,
Blockdaemon,Blockdaemon,Platform,Blockdaemon is the largest independent blockchain infrastructure platform connecting institutions and developers to leading networks.,There is no data on the upcoming ICO.,"183,000,000",183000000,https://blockdaemon.com/?utm_source=icodrops,,,https://twitter.com/_blockdaemon?lang=en,,,,,ERC20,,,,,,UTILITY,Funding Round # https://www.coindesk.com/blockchain-staking-firm-blockdaemon-raises-28m-in-series-a-funding,,,,,https://blockdaemon.com/blog/,,,,Series B Funding Round # https://www.theblockcrypto.com/linked/118240/blockchain-startup-blockdaemon-raises-155-million-in-series-b-funding,,,,,,,,,,,,
Flare,Flare,Network,The Flare Network is a distributed network running the Avalanche consensus protocol adapted to Federated Byzantine Agreement and leveraging the Ethereum Virtual Machine.,There is no data on the upcoming ICO.,"11,300,000",11300000,https://ru.flare.xyz/?utm_source=icodrops,https://drive.google.com/file/d/193JQKBZ-tZ1zuM8BkaTe_RWYhhZCjwIN/view,,https://twitter.com/FlareNetworks,https://t.me/FlareNetwork,,https://discord.gg/XqNa7Rq,FLR,ERC20,,,,,,UTILITY,Funding Round # https://decrypt.co/73008/flare-network-raises-11-3m-in-funding-round-with-kenetic-dcg,,,,,https://www.youtube.com/channel/UCXDchDJ0Tkbh3muRuzaTTDw,,,,Docs # https://docs.flare.network/en/,,,,,,,,,,,,
Partisia Blockchain,Partisia Blockchain,Blockchain,"Partisia Blockchain is a Web 3.0 public blockchain built for trust, transparency, privacy, and speed of light finalization.",There is no data on the upcoming ICO.,"20,000,000",20000000,https://www.partisiablockchain.com/#/?utm_source=icodrops,https://partisia.com/partisia-blockchain-whitepaper/,,https://twitter.com/partisiampc,https://t.me/partisiampc,https://partisiampc.medium.com/,,MPC,ERC20,,,,,,UTILITY,Seed Round # https://partisiampc.medium.com/partisia-blockchain-foundation-has-surpassed-20mm-in-early-contribution-sales-2e3677b3c026,,,,,https://www.linkedin.com/company/privacy-blockchain/?viewAsMember=true,,,,,,,,,,,,,,,,
Snickerdoodle Labs,Snickerdoodle Labs,Blockchain Service,Snickerdoodle is using blockchain technology to build a data economy that protects user privacy and distributes value to all stakeholders.,There is no data on the upcoming ICO.,"2,300,000",2300000,https://www.snickerdoodlelabs.io/?utm_source=icodrops,,,https://twitter.com/YoSnickerdoodle,,,,,ERC20,,,,,,UTILITY,Seed Funding Round # https://www.theblockcrypto.com/post/107329/data-privacy-focused-nft-startup-raises-2-3-million-in-seed-funding,,,,,https://www.linkedin.com/company/snickerdoodlelabs/,,,,,,,,,,,,,,,,
DeFi11,DeFi11,Gaming,DeFi11 is the world’s first defi powered fully decentralized gaming ecosystem for fantasy sports and NFT gaming.,There is no data on the upcoming ICO.,"3,500,000",3500000,https://www.defieleven.com/?utm_source=icodrops,https://www.defieleven.com/white_paper_defi.pdf,https://www.facebook.com/DeFi11-108639401314811,https://twitter.com/defi_11,https://t.me/joinchat/I3tuTErAaD26rD17,https://medium.com/defi11,https://discord.gg/mzQVe3nM,ILO,ERC20,,,,"275,000,000",275000000,UTILITY,Funding Round # https://medium.com/defi11/defi11-successfully-closes-funding-round-and-have-raised-3-5-3d67ada341dd,,,"3,950,000",3950000,https://www.youtube.com/channel/UCaoTjVqPUW2oy-StEIuIAIw,,,,Pitch Deck # https://www.defieleven.com/DeFi11_Pitch_Deck_temp.pdf,,,,https://www.reddit.com/user/defieleven,,,,,,,,
Pontem Network,,,,,"4,500,000",4500000,https://pontem.network/?utm_source=icodrops,https://docs.pontem.network/,,https://twitter.com/PontemNetwork,https://t.me/pontemnetworkchat,https://pontem.medium.com/,,PONT,ERC20,,,,,,UTILITY,Seed Investment Round # https://cointelegraph.com/news/dapp-for-upcoming-diem-blockchain-raises-4-5m-in-seed-investments,,,,,https://github.com/pontem-network,,,,Testnet # https://pontem.medium.com/pontem-testnet-is-live-on-substrate-210eda14986b,,,,,,,,,,,,
Matrix,Matrix,Blockchain Service,"Matrix uses gamification to boost monetization and engagement for e-sport teams, creators, and digital brands.",There is no data on the upcoming ICO.,OT SET,,https://mtx.gg/?utm_source=icodrops,https://www.notion.so/Work-Matrix-6778ea0bfd184837ae49e5affec5ec79,https://www.facebook.com/YouAreMatrix/,https://twitter.com/youarematrix?lang=en,,,https://discord.gg/matrix,,ERC20,,,,,,UTILITY,,,,,,,,,,,,,,,,,,,,,,
Koi Protocol,Koi Protocol,Protocol,"The Koi Protocol enables cross-chain applications to scale seamlessly, and provides simple solutions for integrated incentives.",There is no data on the upcoming ICO.,OT SET,,https://openkoi.com/?utm_source=icodrops,https://openkoi.com/Lightpaper.pdf,,https://twitter.com/open_koi,https://t.me/joinchat/OEHs_8T9-8ZhZmU5,,https://discord.com/invite/SDwgnjxNEn,,ERC20,,,,,,UTILITY,Technical Paper # https://openkoi.com/koi-protocol.pdf,,,,,https://www.youtube.com/watch?v=g0sT-0NqWUY,,,,,,,,,,,,,,,,
ImpactMarket,ImpactMarket,Platform,"ImpactMarket is an open and free platform that allows the creation and distribution of unconditional basic income between communities and their beneficiaries, according to their needs.",There is no data on the upcoming ICO.,OT SET,,https://www.impactmarket.com/?utm_source=icodrops,https://docs.impactmarket.com/,https://www.facebook.com/IPCTmarket,https://twitter.com/IPCTmarket,https://t.me/impactMarket,,,,ERC20,,,,,,UTILITY,,,,,,https://www.linkedin.com/company/impactmarket,,,,,,,,,,,,,,,,
Qilin,Qilin,Protocol,Qilin is a decentralized volatility protocol that provides the ability to long volalitity of any crypto asset.,There is no data on the upcoming ICO.,"800,000",800000,https://qilin.fi/?utm_source=icodrops,https://docs.qilin.fi/,,https://twitter.com/QilinProtocol,https://t.me/QilinOfficial,https://qilinprotocol.medium.com/,https://discord.gg/pv5FBH7UGs,QI,ERC20,,,,"100,000,000",100000000,UTILITY,Seed Round # https://cointelegraph.com/press-releases/qilin-protocol-raised-800k-in-its-initial-round-led-by-multicoin-capital,,,,,https://github.com/CodexDao/QiLin,,,,,,,,,,,,,,,,
everFinance,everFinance,Finance,everFinance is a decentralized financial service for everyone.,There is no data on the upcoming ICO.,OT SET,,https://ever.finance/?utm_source=icodrops,,,https://twitter.com/FinanceEver,,https://medium.com/everfinance,https://discord.gg/SWnkxttZ,,ERC20,,,,,,UTILITY,,,,,,https://github.com/everFinance,,,,,,,,,,,,,,,,
Pintu,Pintu,Blockchain Service,Pintu is Indonesia's leading Blockchain technology company.,There is no data on the upcoming ICO.,"6,000,000",6000000,https://pintu.co.id/?utm_source=icodrops,,https://www.facebook.com/pintucrypto,https://twitter.com/pintuid,https://t.me/pintuindonesia,,,,ERC20,,,,,,UTILITY,Seed Round # https://www.techinasia.com/coinbase-pantera-capital-join-6m-round-indonesian-crypto-exchange-pintu,,,,,https://www.youtube.com/channel/UCxMqlU6lOi88KVgYtRnuZog,,,,,,,,,,,,,,,,
Solidus Labs,Solidus Labs,Market,"Solidus Labs is the first automated, comprehensive and testable market surveillance and risk monitoring hub tailored for digital assets.",There is no data on the upcoming ICO.,"20,000,000",20000000,https://www.soliduslabs.com/?utm_source=icodrops,https://docsend.com/view/pds9qzxbjerepzkm,,https://twitter.com/solidus_labs,,https://medium.com/@SolidusLabs,,,ERC20,,,,,,UTILITY,Seed Round # https://www.coindesk.com/solidus-labs-raises-20m-from-vcs-ex-regulators-to-fight-crypto-market-manipulation,,,,,https://www.youtube.com/channel/UCELQtVtiTBjnX884r_0QBnA,,,,,,,,,,,,,,,,
Certora,Certora,Blockchain Service,Making trusted blockchain a reality with fully automatic exact verification technology for smart contracts.,There is no data on the upcoming ICO.,"7,200,000",7200000,https://www.certora.com/#?utm_source=icodrops,,,https://twitter.com/CertoraInc,,,,,ERC20,,,,,,UTILITY,,,,,,https://www.youtube.com/channel/UC4DzjIwy_5afMxSI4mOpLHw,,,,,,,,,,,,,,,,
HaloDAO,HaloDAO,Protocol,HaloDAO connects traditional and decentralised finance by providing the decentralised infrastructure for next generation payments and settlement.,There is no data on the upcoming ICO.,"3,500,000",3500000,https://www.halodao.com/?utm_source=icodrops,https://docs.halodao.com/,,https://twitter.com/HaloDAOFinance,https://t.me/HaloDAO,https://medium.com/halodao,https://discord.gg/frY97mxD5j,,ERC20,,,,,,UTILITY,Seed Round # https://cointelegraph.com/news/halodao-stablecoin-marketplace-raises-3-5m-in-seed-investments/amp,,,,,,,,,,,,,,,,,,,,,
Tibles,Tibles,Blockchain Service,Tibles is digital collecting ecosystem on the Flow blockchain.,There is no data on the upcoming ICO.,"1,140,000",1140000,https://tibles.com/?utm_source=icodrops,,,https://twitter.com/tiblesHQ,,https://medium.com/tibles,,,ERC20,,,,,,UTILITY,Seed Round # https://www.forbes.com/sites/timcasey/2021/05/20/dapper-labs-leads-114-million-seed-round-investment-in-digital-collectibles-company/?sh=44133cd56aba,,,,,,,,,,,,,,,,,,,,,
Flux Protocol,Flux Protocol,Protocol,Flux is the easiest protocol for developers launching open financial primitives.,There is no data on the upcoming ICO.,"10,300,000",10300000,https://www.fluxprotocol.org/?utm_source=icodrops,,,https://twitter.com/fluxprotocol,https://t.me/fluxprotocol,,,FLUX,ERC20,,,,,,UTILITY,Seed Round # https://www.coindesk.com/flux-protocol-raises-10-3m-seed-round-to-build-defi-infrastructure-on-near,,,,,https://www.fluxprotocol.org/blog,,,,Beta Program # https://www.fluxprotocol.org/blog/introducing-the-flux-beta-program,,,,,,,,,,,,
MCDEX,MCDEX,Exchange,"MCDEX (Monte Carlo DEX) is a decentralized derivatives exchange for traders to long/short efficiently and securely, enabling leverage trading with max gain and loss.",There is no data on the upcoming ICO.,"7,000,000",7000000,https://mcdex.io/homepage/?utm_source=icodrops,,,https://twitter.com/MonteCarloDEX,https://t.me/Mcdex,https://mcdex.medium.com/,https://discord.gg/uut3V3D,MCB,ERC20,,,,,,UTILITY,Investment Round # https://mcdex.medium.com/mcdex-closes-7m-investment-962512f40c97,,,,,https://www.youtube.com/channel/UCXpuA2EJUW6XKlCXKI2fuWw/featured,,,,,,,,,,,,,,,,
TWO TWO,TWO TWO,Platform,TWO TWO is the world’s first Interactive Art Gallery.,There is no data on the upcoming ICO.,"2,090,000",2090000,https://www.twotwoart.com/?utm_source=icodrops,https://docsend.com/view/q3ikmy2ijbyedv3c,https://www.facebook.com/twotwoart,https://twitter.com/Twotwoart,https://t.me/TWOTWOofficial,https://medium.com/@twotwoart,,X22,ERC20,,,,"22,000,022",22000022,UTILITY,,,,,,,,,,,,,,,,,,,,,,
Vertalo,Vertalo,Blockchain Service,Vertalo is an industry-leading solution for digital asset lifecycle management.,There is no data on the upcoming ICO.,"5,000,000",5000000,https://www.vertalo.com/?utm_source=icodrops,,https://www.facebook.com/Vertalo-413757739053125/,https://twitter.com/Vertalo_,https://t.me/vertalotoken,https://medium.com/@Vertalo,,V-TOKEN,ERC20,,,,,,UTILITY,Funding Round # https://www.coindesk.com/coinbase-funding-vertalo,,,,,https://www.youtube.com/channel/UCvUAhmX0cqgvhUmNzZo0c5Q,,,,,,,,,,,,,,,,
Suterusu,Suterusu,Blockchain Service,Suterusu brings ZCash level privacy to any blockchain platform or application.,There is no data on the upcoming ICO.,OT SET,,https://shield.suterusu.io/?utm_source=icodrops,,,https://twitter.com/suterusu_io,https://t.me/suterusu_en,https://suterusu.medium.com/,,,ERC20,,,,,,UTILITY,,,,,,,,,,,,,,,,,,,,,,
Zapper,Zapper,Blockchain Service,"The Zapper provides some of the most robust DeFi related data, everything from liquidity and prices on different AMMs to complex DeFi protocol balances.",There is no data on the upcoming ICO.,"15,000,000",15000000,https://zapper.fi/?utm_source=icodrops,https://docs.zapper.fi/,,https://twitter.com/zapper_fi,,,https://discordapp.com/invite/h6CGbuN,,ERC20,,,,,,UTILITY,Funding Round # https://www.coindesk.com/defi-dashboard-zapper-raises-15m-to-build-on-platform-app-store,,,,,,,,,,,,,,,,,,,,,
Commonwealth,Commonwealth,Platform,"Commonwealth is an all-in-one platform for on-chain communities to discuss, vote, and fund projects together.",There is no data on the upcoming ICO.,"3,200,000",3200000,https://commonwealth.im/?utm_source=icodrops,,,https://twitter.com/hicommonwealth,https://t.me/HiCommonwealth,,https://discord.com/invite/ZFQCKUMP,,ERC20,,,,,,UTILITY,Funding Round # https://www.coindesk.com/commonwealth-labs-raises-3-2m-to-streamline-defi-governance,,,,,https://commonwealth.im/blog,,,,,,,,,,,,,,,,
Liquefy,Liquefy,Blockchain Service,Liquefy brings innovation to real asset investments with blockchain technology and Web 3.0 applications.,There is no data on the upcoming ICO.,OT SET,,https://liquefy.com/?utm_source=icodrops,,,https://twitter.com/LiquefyOfficial?s=20,,https://medium.com/liquefy,,,ERC20,,,,,,UTILITY,,,,,,https://www.linkedin.com/company/liquefytech/,,,,,,,,,,,,,,,,
Animoca Brands,Animoca Brands,Blockchain Service,"Animoca Brands leverages gamification, blockchain and alI technologies to develop and publish a broad portfolio of mobile products and games.",There is no data on the upcoming ICO.,"88,000,000",88000000,https://www.animocabrands.com/?utm_source=icodrops,https://www.animocabrands.com/press-kit,https://www.facebook.com/animocabrands,https://twitter.com/animocabrands,,https://animocabrands.medium.com/,,REVV,ERC20,,,,,,UTILITY,Seed Round # https://venturebeat.com/2021/05/13/animoca-brands-raises-88-million-at-1-billion-valuation-to-capitalize-on-game-nfts/,,,,,https://www.linkedin.com/company/animoca-brands,,,,,,,,,,,,,,,,
Bit.Country,Bit.Country,Blockchain Service,Bit.Country is a decentralized world - putting community first. Everyone can start their own metaverse with the token economy and DAO.,There is no data on the upcoming ICO.,"4,000,000",4000000,https://bit.country/?utm_source=icodrops,https://drive.google.com/file/d/1Cwvr3WmRrUG8cLclCIHDLtyJAirJW82t/view,https://www.facebook.com/bitcountry/,https://twitter.com/bitdotcountry,https://t.me/bitcountryofficial,https://bitcountry.medium.com/,,NUUM,ERC20,,,,,,UTILITY,Seed Round # https://bitcountry.medium.com/bit-country-raises-4m-seed-funding-to-start-individualized-metaverses-5dd965cc5c36,,,,,https://www.linkedin.com/company/bit-country,,,,Ambassador Program # https://bit.country/ambassador-program,,,,,,,,,,,,
Jenny Metaverse,Jenny Metaverse,Blockchain Service,Jenny is a decentralized ERC-20 NFT minted on the Unicly Protocol.,There is no data on the upcoming ICO.,"7,000,000",7000000,https://jennynft.io/?utm_source=icodrops,https://github.com/JennyMetaverse/Litepaper/blob/main/JENNY%20Token%20Litepaper.pdf,,https://twitter.com/JennyMetaverse,,,,UJENNY,ERC20,,,,,,UTILITY,Seed Round # https://www.coindesk.com/dao-raises-7m-to-acquire-and-fractionalize-nft-collections,,,,,,,,,,,,,,,,,,,,,
