Valhalla,Valhalla,Gaming,Valhalla is a combat Play-to-Earn RPG game in a medieval Scandinavian setting based on blockchain and NFT technologies.,There is no data on the upcoming ICO.,OT SET,,https://valhalla.land/#?utm_source=icodrops,,,https://twitter.com/valhallanft,https://valhallanft.medium.com/,,,,ERC20,,,,,,UTILITY,,,,,,https://www.youtube.com/channel/UCa3Zi_ebaVRWAVl4ijtPKyA,,,,,,,,,,,,,,,,
TrueLayer,TrueLayer,Blockchain Service,"TrueLayer allows applications to connect securely with their End user’s bank, in order to either read their financial data, gain insight into their income and spending patterns, or initiate payments.",There is no data on the upcoming ICO.,"130,000,000",130000000,https://truelayer.com/?utm_source=icodrops,https://docs.truelayer.com/,https://www.facebook.com/TrueLayerAPI/,https://twitter.com/TrueLayer/,,,,,ERC20,,,,,,UTILITY,Seed Round # https://truelayer.com/blog/130m-fundraise-to-accelerate-open-banking-payments,,,,,https://www.youtube.com/channel/UCgCJvUI1ViLmlNzwPoRjcTw,,,,,,,,,,,,,,,,
Metrika,Metrika,Blockchain Service,Metrika is a operational intelligence for blockchain networks.,There is no data on the upcoming ICO.,"14,000,000",14000000,https://www.metrika.co/?utm_source=icodrops,,,https://twitter.com/metrikaco/,,,,,ERC20,,,,,,UTILITY,Series A Funding Round # https://www.prnewswire.com/news-releases/metrika-closes-14m-series-a-funding-round-to-ensure-blockchain-network-reliability-through-advanced-tools-and-monitoring-301381635.html,,,,,https://blog.metrika.co/,,,,,,,,,,,,,,,,
Clearpool,Clearpool,Blockchain Service,"Clearpool is a decentralized capital markets ecosystem, creating a paradigm shift in how institutions borrow uncollateralized liquidity.",There is no data on the upcoming ICO.,OT SET,,https://clearpool.finance/?utm_source=icodrops,,,https://twitter.com/ClearpoolFin,https://t.me/clearpoolofficial,https://clearpool.medium.com/,,CPOOL,ERC20,,,,,,UTILITY,,,,,,https://github.com/clearpool-finance,,,,,,,,,,,,,,,,
LayerZero,LayerZero,Protocol,LayerZero is a unified multichain messaging protocol,There is no data on the upcoming ICO.,"6,000,000",6000000,https://layerzero.network/?utm_source=icodrops,https://www.dropbox.com/s/dm8zqpr04sibk7a/LayerZero_Whitepaper_Release.pdf?dl=1,,https://twitter.com/LayerZero_Labs,https://t.me/joinchat/VcqxYkStIDsyN2Rh,https://medium.com/layerzero-official,https://discord.gg/67ckMegEY8,,ERC20,,,,,,UTILITY,Series A Funding Round # https://www.binance.com/en/blog/421499824684902766/ecosystem/binance-labs-and-multicoin-capital-coled-$6m-series-a-for-layerzero?ref=JLI1VBLA&utm_source=BinanceTwitter&utm_medium=GlobalSocial&utm_campaign=GlobalSocial,,,,,,,,,,,,,,,,,,,,,
Minterest,Minterest,Protocol,Minterest is a ground-breaking lending protocol built by industry leaders to service billions in TVL and to challenge existing DeFi incumbents.,There is no data on the upcoming ICO.,"6,500,000",6500000,https://minterest.com/?utm_source=icodrops,,,https://twitter.com/Minterest,https://t.me/MinterestFinanceChat,,,,ERC20,,,,,,UTILITY,Seed Round # https://finance.yahoo.com/news/following-6-5m-raise-defi-120000050.html,,,,,https://minterest.com/blog#!/tfeeds/507712053931/c/Blog,,,,,,,,,,,,,,,,
Envelop,Envelop,Protocol,Envelop is a cross-chain protocol to provide NFT with real value.,There is no data on the upcoming ICO.,"1,000,000",1000000,https://envelop.is/?utm_source=icodrops,,,https://twitter.com/Envelop_project,https://t.me/niftsy_en,https://envelop.medium.com/,,NIFTSY,ERC20,,,,,,UTILITY,FAQ # https://envelop.is/#qna,,,,,https://www.youtube.com/c/ENVELOP,,,,Grant From Rarible # https://envelop.medium.com/nft-startup-niftsy-raises-over-1m-receives-grant-from-rarible-1b817341653f?source=user_profile---------7----------------------------,,,,,,,,,,,,
Domination Finance,Domination Finance,DEX,Domination Finance is a non-custodial financial instrument and exchange that allows users to trade dominance pairs or earn trading fees by providing liquidity.,There is no data on the upcoming ICO.,"3,200,000",3200000,https://domination.finance/?utm_source=icodrops,https://docs.domination.finance/,,https://twitter.com/dominationfi,,,https://discord.domination.finance/,,ERC20,,,,,,UTILITY,Seed Round # https://www.yahoo.com/now/domination-finance-raises-3-2-182500738.html?guccounter=1,,,,,https://www.linkedin.com/company/domination-finance,,,,FAQ # https://info.domination.finance/#faqs,,,,,,,,,,,,
Stardust,Stardust,Platform,Stardust is a software platform empowering video games with crypto functionality and security.,There is no data on the upcoming ICO.,"5,000,000",5000000,https://www.stardust.gg/?utm_source=icodrops,,,https://twitter.com/StardustPlatfrm,,,,,ERC20,,,,,,UTILITY,Seed Round # https://venturebeat.com/2021/09/15/stardust-raises-5m-to-provide-secure-u-s-dollar-payments-for-nfts-in-games/amp/?__twitter_impression=true,,,,,https://www.stardust.gg/blog,,,,,,,,,,,,,,,,
AcknoLedger,AcknoLedger,Platform,"AcknoLedger is a global platform which maps, monetize, and distributes Web 3.0 Digital Assets Seamlessly across all the Metaverses and Gaming NFTs.",There is no data on the upcoming ICO.,"1,800,000",1800000,https://acknoledger.com/?utm_source=icodrops,,https://www.facebook.com/AcknoLedger-100963082154551,https://twitter.com/acknoledger,https://t.me/acknoledgercommunity,https://medium.com/@acknoledger,,ACK,ERC20,,,,"117,718,487",117718487,UTILITY,FAQ # https://acknoledger.com/faqs/,,,,,https://www.linkedin.com/company/acknoledger/,,,,,,,,,,,,,,,,
Abra,Abra,Platform,Abra is a crypto wealth management platform.,There is no data on the upcoming ICO.,"85,000,000",85000000,https://www.abra.com/?utm_source=icodrops,,https://www.facebook.com/AbraGlobal,https://twitter.com/AbraGlobal,,,,,ERC20,,,,,,UTILITY,Series C Funding Round # https://www.theblockcrypto.com/amp/linked/117729/crypto-wealth-manager-abra-bags-55-million-series-c-raise?__twitter_impression=true,,,,,https://www.youtube.com/channel/UCMb7-snlNp7ctSVlpqMbXFw?view_as=subscriber,,,,FAQ # https://abra.zendesk.com/hc/en-us,,,,https://www.reddit.com/user/AbraGlobal/,,,,,,,,
Vee.Finance,Vee.Finance,Platform,Vee Finance is a DeFi lending platform for traditional financial users.,There is no data on the upcoming ICO.,"5,300,000",5300000,https://vee.finance/home?utm_source=icodrops,https://docs.vee.finance/governance/whitepaper,,https://twitter.com/VeeFinance,https://t.me/veefin,https://veefi.medium.com/,https://discord.com/invite/2BntW5NGzM,VEE,ERC20,,,,"10,000,000,000",10000000000,UTILITY,Private Round # https://veefi.medium.com/vee-finance-closes-5-3-million-private-round-d7f88f50519b,,,"8,800,000",8800000,https://www.youtube.com/channel/UCcDw1HGfYmqnnRzo9n91EXw,,,,,,,,https://www.reddit.com/r/VeeFinance/,,,,,,,,
Amberdata,Amberdata,Blockchain Service,Amberdata is a blockchain and crypto asset market data provider.,There is no data on the upcoming ICO.,"15,000,000",15000000,https://amberdata.io/?utm_source=icodrops,https://amberdata.io/docs,https://www.facebook.com/amberdata.io,https://twitter.com/Amberdataio,,https://medium.com/amberdata,,,ERC20,,,,,,UTILITY,Series A Funding Round # https://www.theblockcrypto.com/linked/117609/citi-leads-15-million-series-a-for-crypto-data-startup-amberdata,,,,,,,,,,,,,,,,,,,,,
Apollo,Apollo,Platform,Apollo is a yield management platform built by DeFi users for DeFi users.,There is no data on the upcoming ICO.,"2,200,000",2200000,https://apollo.farm/?utm_source=icodrops,,,https://twitter.com/ApolloDAO,https://t.me/apollodao,https://apollodao.medium.com/,https://discord.gg/j3KxMR8ZjZ,APOLLO,ERC20,,,,"100,000,000",100000000,UTILITY,Seed Round # https://apollodao.medium.com/apollo-daos-strategic-partners-2cd6ddfab679,,,,,,,,,,,,,,,,,,,,,
Good Games Guild,Good Games Guild,Blockchain Service,Good Games Guild (GGG) is a decentralized autonomous organization (DAO) that focus on non fungible tokens (NFTs) that oftenly used in blockchain-based games & virtual product.,There is no data on the upcoming ICO.,OT SET,,https://goodgamesguild.com/?utm_source=icodrops,,,https://twitter.com/goodgamesguild,https://t.me/GoodGamesGuildAnn,https://medium.com/@goodgamesguild/,https://discord.gg/x47U9qkR5K,,ERC20,,,,,,UTILITY,,,,,,,,,,,,,,,,,,,,,,
Unbound,Unbound,Protocol,"Unbound finance is a decentralized, cross-chain liquidity protocol that is building the next money lego by unlocking the liquidity from AMMs.",There is no data on the upcoming ICO.,"5,800,000",5800000,https://unbound.finance/?utm_source=icodrops,https://docs.unbound.finance/documentation/whitepaper,,https://twitter.com/unboundfinance,https://t.me/unboundfinance,https://unboundfinance.medium.com/,,UNB,ERC20,,,,"10,000,000",10000000,UTILITY,FAQ # https://docs.unbound.finance/documentation/faqs,,,,,https://github.com/unbound-finance/,,,,Seed Round # https://unboundfinance.medium.com/unbound-finance-raises-5-8m-led-by-pantera-capital-and-michael-arringtons-xrp-capital-cbe10392706e,,,,,,,,,,,,
X-Margin,X-Margin,Platform,X-Margin credit is a complete platform for managing the lending and borrowing life-cycle.,There is no data on the upcoming ICO.,"8,000,000",8000000,https://xmargin.io/?utm_source=icodrops,,,https://twitter.com/xmargintrading,https://t.me/xmargin,,,,ERC20,,,,,,UTILITY,Seed Round # https://www.coindesk.com/business/2021/09/13/zero-knowledge-credit-risk-platform-x-margin-raises-8m/,,,,,https://www.linkedin.com/company/xmargin/,,,,FAQ # https://xmargin.io/faq.html,,,,,,,,,,,,
bitsCrunch,bitsCrunch,Blockchain Service,bitsCrunch is the Guardian of the NFT ecosystem.,There is no data on the upcoming ICO.,"750,000",750000,https://bitscrunch.com/?utm_source=icodrops,,https://www.facebook.com/bitsCrunch/,https://twitter.com/bitscrunch,https://t.me/bitscrunch,https://medium.com/@bitscrunch,,,ERC20,,,,,,UTILITY,Seed Round # https://yourstory.com/2021/09/funding-nft-focussed-blockchain-analytics-startup-bitscrunch/amp,,,,,https://www.youtube.com/c/bitscrunch,,,,,,,,,,,,,,,,
UXD Protocol,UXD Protocol,Stablecoin,UXD Protocol is a crypto native stablecoin backed by a delta neutral position using derivatives.,There is no data on the upcoming ICO.,"3,000,000",3000000,https://uxd.fi/?utm_source=icodrops,https://uxd.fi/static/media/whitepaper.7be6354b.pdf,,https://twitter.com/UXDProtocol,,https://uxdprotocol.medium.com/,https://discord.gg/BHfpYmjsBM,UXD,ERC20,,,,,,UTILITY,Seed Round # https://uxdprotocol.medium.com/uxd-protocol-announces-3-million-seed-round-led-by-multicoin-capital-f5037c001a87,,,,,,,,,Docs # https://docs.uxd.fi/uxdprotocol/,,,,,,,,,,,,
SZNS,SZNS,Protocol,"SZNS is a decentralized protocol for multi-NFT indexes, swaps, and lending.",There is no data on the upcoming ICO.,"4,000,000",4000000,https://szns.io/?utm_source=icodrops,https://storage.googleapis.com/szns-landingpage/%5BSZNS%5DLitepaper_20210614.pdf,,https://twitter.com/sznsNFT,,https://szns.medium.com/,https://discord.gg/nwNQVQSB5u,SZNS,ERC20,,,,,,UTILITY,Seed Round # https://www.coindesk.com/tech/2021/09/09/fractionalized-nfts-get-funding-boost-as-szns-raises-4m-from-framework-dragonfly/,,,,,,,,,,,,,,,,,,,,,
Eden Network,Eden Network,Protocol,"Eden Network is an optional, non-consensus breaking transaction ordering protocol for Ethereum blocks which allows network participants to guarantee placement and protection from arbitrary reordering.",There is no data on the upcoming ICO.,"17,400,000",17400000,https://www.edennetwork.io/?utm_source=icodrops,https://edennetwork.io/EDEN_Network___Whitepaper___2021_07.pdf,,https://twitter.com/edennetwork,https://t.me/Eden_Network,https://medium.com/EdenNetwork,https://discord.io/edennetwork,EDEN,ERC20,,,,"250,000,000",250000000,UTILITY,Seed Round # https://www.theblockcrypto.com/post/116935/eden-network-priority-transaction-ethereum-funding-token-sale,,,,,https://github.com/eden-network,,,,FAQ # https://www.edennetwork.io/faq,Docs # https://docs.edennetwork.io/,,,,,,,,,,,
deBridge,deBridge,Protocol,deBridge is a cross-chain interoperability and liquidity transfer protocol that allows truly decentralized transfer of assets between various blockchains.,There is no data on the upcoming ICO.,"5,500,000",5500000,https://debridge.finance/?utm_source=icodrops,https://docs.debridge.finance/,https://www.facebook.com/deBridgeFinance/,https://twitter.com/deBridgeFinance,https://t.me/deBridge_finance,https://debridge.medium.com/,https://discord.com/invite/2qspXXPJqY,,ERC20,,,,,,UTILITY,Seed Round # https://www.coindesk.com/business/2021/09/07/cross-chain-protocol-debridge-gets-55m-in-seed-funding-round-led-by-parafi-capital/,,,,,https://github.com/debridge-finance/,,,,,,,,,,,,,,,,
XMTP,XMTP,Protocol,XMTP is a communication protocol and network for web3 and crypto.,There is no data on the upcoming ICO.,"20,000,000",20000000,https://xmtp.com/?utm_source=icodrops,,,https://twitter.com/xmtp_,,,,,ERC20,,,,,,UTILITY,Series A Funding Round # https://blog.xmtp.com/series-a/,,,,,https://blog.xmtp.com/,,,,,,,,,,,,,,,,
Arbitrum,Arbitrum,Blockchain Service,Arbitrum is an optimistic rollup built to scale Ethereum.,There is no data on the upcoming ICO.,"120,000,000",120000000,https://arbitrum.io/?utm_source=icodrops,,,https://twitter.com/arbitrum/,,,,,ERC20,,,,,,UTILITY,Funding Round # https://www.theblockcrypto.com/post/116148/ethereum-scaling-solution-arbitrum-launches-mainnet-raises-120-million-funding,,,,,https://t.co/S3UYYqKQWn?amp=1,,,,,,,,,,,,,,,,
Royal,Royal,Platform,Royal is a platform where you can buy ownership in songs directly from your favorite artists and earn royalties with them.,There is no data on the upcoming ICO.,"16,000,000",16000000,https://royal.io/?utm_source=icodrops,,https://www.facebook.com/royalmarketofficial,https://twitter.com/join_royal,,,https://discord.gg/mASJakvuzh,,ERC20,,,,,,UTILITY,Funding Round # https://techcrunch.com/2021/08/26/founders-fund-backs-royal-a-music-marketplace-planning-to-sell-song-rights-as-nfts/amp/?__twitter_impression=true,,,,,https://www.youtube.com/channel/UCY1Ro9e8fCaYnj2Eqzyjcbg,,,,FAQ # https://royal.io/faq,,,,https://www.reddit.com/r/join_royal,,,,,,,,
Slope,Slope,Blockchain Service,Slope is building the future of decentralized exchange and wallet for community.,There is no data on the upcoming ICO.,"2,300,000",2300000,https://slope.finance/#/?utm_source=icodrops,https://drive.google.com/file/d/1jmDMEkjZP3o_75BQhiEFEB5fMkkitVx8/view,,https://twitter.com/slope_finance,https://t.me/Slope_community,https://slope-finance.medium.com/,https://discord.com/channels/851813650183880725/859731067426308126,SLOPE,ERC20,,,,,,UTILITY,Funding Round # https://cointelegraph.com/press-releases/slope-finance-raises-funding-backed-by-alameda-research-solana-capital,,,,,https://github.com/SlopeFinance,,,,,,,,,,,,,,,,
Kalao,Kalao,Blockchain Service,Kalao is an NFT ecosystem leveraging on a cost effective and easy-to-use marketplace powered by Avalanche blockchain technology combined with outstanding Kalao VR capabilities.,There is no data on the upcoming ICO.,"3,150,000",3150000,https://www.kalao.io/?utm_source=icodrops,https://docs.kalao.io/,,https://twitter.com/GetKalao,https://t.me/kalao_announcement,https://medium.com/@Kalao,https://discord.gg/WjcRtmZKPB,KLO,ERC20,,,,"500,000,000",500000000,UTILITY,Registration for Private Sale # https://docs.google.com/forms/d/e/1FAIpQLSc6aHXQsDLiW0wZiR7yCPWlIBYr8TB7oYtO7V0CImHHDh6MvQ/viewform,,,,,https://www.youtube.com/channel/UCCJYSx6pAVYfXzzRKVMD0-g,,,,,,,,,,,,,,,,
Rise Online World,Rise Online World,Gaming,Rise Online is an MMORPG by RokoSoft.,There is no data on the upcoming ICO.,OT SET,,https://www.riseonlineworld.com/en?utm_source=icodrops,,https://www.facebook.com/RiseOnlineWorld,https://twitter.com/RiseOnlineWorld,,,https://www.riseonlineworld.com/discord,,ERC20,,,,,,UTILITY,FAQ # https://www.riseonlineworld.com/en/faq,,,,,https://www.youtube.com/channel/UChzF1HlICfZhm4JEx3yulqw,,,,,,,,,,,,,,,,
Euler,Euler,Protocol,Euler is a capital-efficient permissionless lending protocol that helps users to earn interest on their crypto assets or hedge against volatile markets without the need for a trusted third-party.,There is no data on the upcoming ICO.,"8,000,000",8000000,https://www.euler.finance/#/?utm_source=icodrops,https://docs.euler.finance/getting-started/white-paper,,https://twitter.com/eulerfinance,https://t.me/eulerfinance_official,,https://discord.gg/CdG97VSYGk,,ERC20,,,,,,UTILITY,Series A Funding Round # https://blog.euler.finance/series-a-led-by-paradigm-62004afe3bf6,,,,,https://blog.euler.finance/,,,,,,,,,,,,,,,,
Hedgehog,Hedgehog,Blockchain Service,"Build your portfolio, track your wallets, connect to 130+ exchanges, and trade anywhere.",There is no data on the upcoming ICO.,"5,100,000",5100000,https://hedgehog.app/?utm_source=icodrops,,,https://twitter.com/HedgehogDotApp,,,https://discord.gg/zq3KMCN,,ERC20,,,,,,UTILITY,Seed Round # https://www.coindesk.com/dragonfly-y-combinator-back-seed-round-for-crypto-trading-dashboard-hedgehog,,,,,https://www.youtube.com/channel/UC8j1OiKlJGJJIB7HHqSVgRg,,,,Funding Round # https://www.coindesk.com/hedgehog-is-bringing-prediction-markets-to-solana,,,,,,,,,,,,
Alethea AI,Alethea AI,Blockchain Service,"Alethea AI will enable a metaverse of millions of intelligent and interactive characters to emerge, with their own thriving economics.",There is no data on the upcoming ICO.,"16,000,000",16000000,https://alethea.ai/?utm_source=icodrops,,,https://twitter.com/real_alethea,https://t.me/alethea_ai,https://medium.com/alethea-ai,https://discord.gg/x2Nj6MGEwN,,ERC20,,,,,,UTILITY,Private Token Sale # https://medium.com/@arikhan/announcing-our-successful-private-token-sale-f690343e6385,,,,,https://www.youtube.com/channel/UC3WLysYnxlErUeCeXxzVRLA,,,,,,,,https://www.reddit.com/r/Alethea/,,,,,,,,
XREX,XREX,Blockchain Service,"XREX is a blockchain TradeTech company, helps merchants in emerging economies accelerate international transaction by providing SaaS that facilitate digital asset transfer, banking and trading.",There is no data on the upcoming ICO.,"17,000,000",17000000,https://www.xrex.io/?utm_source=icodrops,,,https://twitter.com/xrexinc,https://t.me/xrexofficial,https://medium.com/xrexio,,,ERC20,,,,,,UTILITY,Seed Round # https://blog.xrex.io/xrex-raises-17m-to-expand-fiat-currency-portfolio-and-partnerships-2caf4025b07a,,,,,https://linkedin.com/company/xrexinc/,,,,,,,,,,,,,,,,
Oh! Finance,Oh! Finance,DeFi,Oh! Finance aggregates popular DeFi investment strategies and automatically compounds your earnings.,There is no data on the upcoming ICO.,"1,090,000",1090000,https://oh.finance/?utm_source=icodrops,https://assets.oh.finance/OhFinance_Intro_Deck.pdf,,https://twitter.com/OhFinanceDefi,https://t.me/OhFinanceDefi,https://ohfinance.medium.com/,,OH,ERC20,,,,"100,000,000",100000000,UTILITY,,,,,,,,,,,,,,,,,,,,,,
Chainflip,Chainflip,Protocol,"Chainflip is a decentralised, trustless protocol that enables cross chain swaps between different blockchains.",There is no data on the upcoming ICO.,"6,000,000",6000000,https://chainflip.io/?utm_source=icodrops,https://chainflip.io/whitepaper.pdf,,https://twitter.com/chainflip,https://t.me/chainflip_io_chat,,https://discord.gg/8zbsqDsfyp,FLIP,ERC20,,,,,,UTILITY,Lightpaper # https://chainflip.io/lightpaper.pdf,,,,,https://blog.chainflip.io/,,,,FAQ # https://chainflip.io/faq,Seed Round # https://www.coindesk.com/cross-chain-protocol-chainflip-raises-6m-to-fund-growth-security-audits,,,,,,,,,,,
KYVE,KYVE,Blockchain Service,KYVE is a decentralized archiving and caching solution that allows modern blockchains and decentralized applications (dApps) to store and serve data reliably.,There is no data on the upcoming ICO.,OT SET,,https://www.kyve.network/?utm_source=icodrops,https://docs.kyve.network/,,https://twitter.com/kyvenetwork,https://t.me/kyvenet,,https://discord.gg/E73KZwaa4S,KYVE,ERC20,,,,,,UTILITY,Litepaper # https://www.kyve.network/litepaper.pdf,,,,,https://blog.kyve.network/,,,,,,,,,,,,,,,,
Dune Analytics,Dune Analytics,Blockchain Service,"Dune Analytics is a powerful tool for blockchain research. Dune gives you all the tools to query, extract, and visualize vast amounts of data from the blockchain.",There is no data on the upcoming ICO.,"8,000,000",8000000,https://dune.xyz/home?utm_source=icodrops,https://docs.duneanalytics.com/,,https://twitter.com/DuneAnalytics,,,https://discord.gg/ErrzwBz,,ERC20,,,,,,UTILITY,Series A Funding Round # https://dune.xyz/blog/series-a,,,,,https://dune.xyz/blog,,,,,,,,,,,,,,,,
Exactly,Exactly,Blockchain Service,"Exactly is building an open source, non-custodial protocol on Ethereum, that will bring fixed-income solutions for lenders and borrowers.",There is no data on the upcoming ICO.,"3,000,000",3000000,https://exactly.finance/?utm_source=icodrops,,,https://twitter.com/exactly_finance,https://t.me/exactlyFinance,https://medium.com/@exactly_finance,https://discord.gg/6HppqAxQut,,ERC20,,,,,,UTILITY,Seed Funding Round # https://medium.com/@exactly_finance/exactly-raises-3-million-in-seed-funding-to-bring-fixed-income-to-defi-a20242f54201,,,,,https://www.linkedin.com/company/exactly-finance/,,,,,,,,,,,,,,,,
Ondo Finance,Ondo Finance,Blockchain Service,Ondo Finance allows crypto-asset investors to trade the risk and reward balance of pooled assets.,There is no data on the upcoming ICO.,"4,000,000",4000000,https://ondo.finance/?utm_source=icodrops,https://docs.ondo.finance/,,https://www.twitter.com/OndoFinance,https://t.me/ondofinance,,https://discord.gg/qNqhRGv76B,,ERC20,,,,,,UTILITY,Seed Round # https://www.coindesk.com/ex-goldman-sachs-traders-raise-4m-for-defi-risk-management-startup,,,,,https://blog.ondo.finance/,,,,FAQ # https://docs.ondo.finance/faq,,,,,,,,,,,,
Tally,Tally,Blockchain Service,"Tally empowers user owned governance through a voting dashboard, governance tooling, real time research and analysis, and an evergreen wiki.",There is no data on the upcoming ICO.,"7,500,000",7500000,https://www.withtally.com/?utm_source=icodrops,https://docs.withtally.com/,,https://twitter.com/voteWithTally,,https://medium.com/tally-blog,https://discord.com/invite/sCGnpWH3m4,,ERC20,,,,,,UTILITY,Seed Round # https://www.coindesk.com/daos-vcs-put-6m-behind-governance-startup-tally,,,,,https://github.com/withtally/,,,,App # https://withtally.com/,Funding Round # https://www.coindesk.com/tally-defi-governance-funding-round,,,,,,,,,,,
Bitwave,Bitwave,Blockchain Service,"Bitwave provides enterprises a complete drop in solution for handling digital assets - tax tracking, automatic mark-to-market, crypto AR/AP, wallets, and DeFi.",There is no data on the upcoming ICO.,"7,250,000",7250000,https://www.bitwave.io/?utm_source=icodrops,https://8e5332d2-78f6-44da-90cb-a792a831a4d7.filesusr.com/ugd/f69f3b_c8d0de75a9b34614a01f9659c82c4174.pdf,,https://twitter.com/BitwavePlatform,,,,,ERC20,,,,,,UTILITY,Seed Round # https://medium.com/@bitwave_platform/bitwave-raise-7-25mil-to-bring-digital-assets-to-enterprises-e9a8d8a9848e,,,,,https://www.youtube.com/channel/UC3eA1Ql5Ay8aio4BDCG4pSA,,,,FAQ # https://www.bitwave.io/faqs,,,,,,,,,,,,
TaxBit,TaxBit,Blockchain Service,TaxBit connects the consumer and enterprise cryptocurrency tax experiences.,There is no data on the upcoming ICO.,"230,000,000",230000000,https://taxbit.com/?utm_source=icodrops,,https://www.facebook.com/TaxBitCom,https://twitter.com/taxbit,,,,,ERC20,,,,,,UTILITY,Series B Funding Round # https://techcrunch.com/2021/08/12/crypto-tax-software-provider-taxbit-raises-130m-at-a-1-33b-valuation/,,,,,https://taxbit.com/blog,,,,,,,,,,,,,,,,
Figment,Figment,Blockchain Service,"Figment is a staking, middleware, and application layer solutions for token holders and developers investing in and building on Web 3 technology.",There is no data on the upcoming ICO.,"50,000,000",50000000,https://figment.io/?utm_source=icodrops,https://learn.figment.io/,,https://twitter.com/Figment_io,https://t.me/figmentnetworks,,https://discord.gg/fszyM7K,,ERC20,,,,,,UTILITY,Series B Funding Round # https://figment.io/resources/figment-announces-50-million-in-series-b-funding/,,,,,,,,,,,,,,,,,,,,,
Goldfinch Finance,Goldfinch Finance,DeFi,Goldfinch is a decentralized credit platform for crypto loans without collateral.,There is no data on the upcoming ICO.,"11,000,000",11000000,https://goldfinch.finance/?utm_source=icodrops,https://goldfinch.finance/goldfinch_whitepaper.pdf,,https://twitter.com/goldfinch_fi,https://t.me/goldfinch_finance,https://medium.com/goldfinch-fi/,https://discord.gg/HVeaca3fN8,FIDU,ERC20,,,,,,UTILITY,Sign up as a Liquidity Provider # https://app.goldfinch.finance/verify,,,,,,,,,Sign up as a Backer # https://forms.gle/dCq1MKD3hSVTQ3BN6,FAQ # https://www.notion.so/Discord-FAQs-79b9c077598f4c928c4b04aff0405a72,,,,,,,,,,,
Panther Protocol,Panther Protocol,Blockchain Service,"Panther Protocol provides DeFi users with interoperable, fully collateralized privacy enhancing digital assets.",There is no data on the upcoming ICO.,OT SET,,https://www.pantherprotocol.io/?utm_source=icodrops,https://docsend.com/view/tbz99g285hbnn8ic,,https://twitter.com/ZkPanther,https://t.me/joinchat/GJ64F-nRiIF86Cxn,,https://discord.gg/WZuRnMCZ4c,ZKP,ERC20,,,,"1,000,000,000",1000000000,UTILITY,,,,,,https://blog.pantherprotocol.io/,,,,,,,,https://www.reddit.com/r/PantherProtocol,,,,,,,,
DeFi Safety,DeFi Safety,Blockchain Service,DeFi Safety is a smart contract quality and transparency for DeFi protocols.,There is no data on the upcoming ICO.,"1,000,000",1000000,https://defisafety.com/?utm_source=icodrops,https://docs.defisafety.com/review-process-documentation/process-quality-audit-process#6-is-there-a-whitepaper-y-n,,https://twitter.com/DefiSafety,https://t.me/joinchat/Hnf-exmsTNGgmq6SYKCPCA,https://medium.com/defi-safety,https://discord.com/invite/pzUw5V2E65,,ERC20,,,,,,UTILITY,Seed Round # https://medium.com/defi-safety/defisafety-seed-raise-completed-1f636efa8b51,,,,,,,,,,,,,,,,,,,,,
